{
  "schema_version": "1.0",
  "registry_id": "claim",
  "registry_version": "2026.09.1",
  "$comment": "Claim identifiers and their analysis domain (brief 11 section 218.2). Claim fields stay in the analysis document; this registry carries the identifier-to-domain mapping that earlier revisions expressed as an id prefix and, later, as a presentation-only field. tools/render-claims.mjs groups the rendered tables from this registry.",
  "entries": [
    {
      "id": "CLAIM-001",
      "domain": "candidate"
    },
    {
      "id": "CLAIM-002",
      "domain": "candidate"
    },
    {
      "id": "CLAIM-003",
      "domain": "candidate"
    },
    {
      "id": "CLAIM-004",
      "domain": "scheduler"
    },
    {
      "id": "CLAIM-005",
      "domain": "scheduler"
    },
    {
      "id": "CLAIM-006",
      "domain": "scheduler"
    },
    {
      "id": "CLAIM-007",
      "domain": "scheduler"
    },
    {
      "id": "CLAIM-008",
      "domain": "scheduler"
    },
    {
      "id": "CLAIM-009",
      "domain": "scheduler"
    },
    {
      "id": "CLAIM-010",
      "domain": "acquisition"
    },
    {
      "id": "CLAIM-011",
      "domain": "acquisition"
    },
    {
      "id": "CLAIM-012",
      "domain": "acquisition"
    },
    {
      "id": "CLAIM-013",
      "domain": "provenance"
    },
    {
      "id": "CLAIM-014",
      "domain": "provenance"
    },
    {
      "id": "CLAIM-015",
      "domain": "provenance"
    },
    {
      "id": "CLAIM-016",
      "domain": "provenance"
    },
    {
      "id": "CLAIM-017",
      "domain": "provenance"
    },
    {
      "id": "CLAIM-018",
      "domain": "provenance"
    },
    {
      "id": "CLAIM-019",
      "domain": "architecture"
    },
    {
      "id": "CLAIM-020",
      "domain": "architecture"
    },
    {
      "id": "CLAIM-021",
      "domain": "architecture"
    },
    {
      "id": "CLAIM-022",
      "domain": "architecture"
    },
    {
      "id": "CLAIM-023",
      "domain": "architecture"
    },
    {
      "id": "CLAIM-024",
      "domain": "architecture"
    },
    {
      "id": "CLAIM-025",
      "domain": "architecture"
    },
    {
      "id": "CLAIM-026",
      "domain": "architecture"
    },
    {
      "id": "CLAIM-027",
      "domain": "architecture"
    },
    {
      "id": "CLAIM-028",
      "domain": "architecture"
    },
    {
      "id": "CLAIM-029",
      "domain": "scope"
    },
    {
      "id": "CLAIM-030",
      "domain": "scope"
    },
    {
      "id": "CLAIM-031",
      "domain": "scope"
    },
    {
      "id": "CLAIM-032",
      "domain": "scope"
    },
    {
      "id": "CLAIM-033",
      "domain": "scope"
    },
    {
      "id": "CLAIM-034",
      "domain": "scope"
    },
    {
      "id": "CLAIM-035",
      "domain": "plan"
    },
    {
      "id": "CLAIM-036",
      "domain": "plan"
    },
    {
      "id": "CLAIM-037",
      "domain": "plan"
    },
    {
      "id": "CLAIM-038",
      "domain": "history"
    },
    {
      "id": "CLAIM-039",
      "domain": "history"
    },
    {
      "id": "CLAIM-040",
      "domain": "history"
    },
    {
      "id": "CLAIM-041",
      "domain": "hypothesis"
    }
  ]
}
